title,price,square_meters,rooms,interior_state,postal_code,neighborhood,url
For rent: Flat Mauritsstraat in Rotterdam,810,21,1,Upholstered,3012 CH,Cool,https://www.pararius.com/apartment-for-rent/rotterdam/ee0419c2/mauritsstraat
For rent: Flat M端llerkade in Rotterdam,2250,56,3,Furnished,3024 EP,Schiemond,https://www.pararius.com/apartment-for-rent/rotterdam/6faabe85/muellerkade
For rent: Flat Spanjaardstraat in Rotterdam,1085,47,2,Upholstered,3025 TW,Bospolder,https://www.pararius.com/apartment-for-rent/rotterdam/400eb796/spanjaardstraat
For rent: Flat Jupiterstraat in Rotterdam,1750,97,2,Upholstered,3054 WH,Hillegersberg Noord,https://www.pararius.com/apartment-for-rent/rotterdam/7e13113d/jupiterstraat
For rent: Flat Wolphaertsbocht in Rotterdam,1495,75,3,Upholstered,3081 KJ,Tarwewijk,https://www.pararius.com/apartment-for-rent/rotterdam/97e9e5ba/wolphaertsbocht
For rent: Flat Boezemsingel in Rotterdam,2295,72,4,Upholstered,3034 EA,Oud Crooswijk,https://www.pararius.com/apartment-for-rent/rotterdam/2cc69cc1/boezemsingel
For rent: Flat Pegasusweg in Rotterdam,1695,105,3,Furnished,3067 KX,Oosterflank,https://www.pararius.com/apartment-for-rent/rotterdam/3a98a9be/pegasusweg
For rent: Flat Louise de Colignylaan 63 in Rotterdam,1750,86,3,Furnished,3062 HC,Kralingen Oost,https://www.pararius.com/apartment-for-rent/rotterdam/e22a2191/louise-de-colignylaan
For rent: Flat Gerrit Jan Mulderstraat in Rotterdam,1595,58,2,Furnished,3023 RL,Nieuwe Westen,https://www.pararius.com/apartment-for-rent/rotterdam/42d74a5a/gerrit-jan-mulderstraat
For rent: Flat Gerrit Jan Mulderstraat in Rotterdam,1550,52,2,Furnished,3023 RL,Nieuwe Westen,https://www.pararius.com/apartment-for-rent/rotterdam/a0dffa19/gerrit-jan-mulderstraat
For rent: Flat Adamshofstraat in Rotterdam,2400,90,3,Furnished,3061 ZB,Kralingen West,https://www.pararius.com/apartment-for-rent/rotterdam/161d7004/adamshofstraat
For rent: Flat Nieuwe Binnenweg in Rotterdam,1095,62,2,Shell,3023 EX,Nieuwe Westen,https://www.pararius.com/apartment-for-rent/rotterdam/11d5eff7/nieuwe-binnenweg
For rent: Flat Heiman Dullaertplein 95 in Rotterdam,1795,118,3,,3024 CD,Delfshaven,https://www.pararius.com/apartment-for-rent/rotterdam/88c3ed63/heiman-dullaertplein
For rent: House Jeroen Boschlaan in Rotterdam,3095,185,6,Upholstered,3055 NN,Molenlaankwartier,https://www.pararius.com/house-for-rent/rotterdam/12e715a3/jeroen-boschlaan
For rent: Studio Katendrechtse Lagedijk in Rotterdam,650,20,1,Upholstered,3082 GA,Oud Charlois,https://www.pararius.com/studio-for-rent/rotterdam/18bf067e/katendrechtse-lagedijk
For rent: Flat Lambertusstraat in Rotterdam,2300,90,3,Furnished,3061 XW,Kralingen West,https://www.pararius.com/apartment-for-rent/rotterdam/752659d1/lambertusstraat
For rent: Flat Tollensstraat in Rotterdam,2350,89,4,Upholstered,3035 NK,Oude Noorden,https://www.pararius.com/apartment-for-rent/rotterdam/cc063cf9/tollensstraat
For rent: Flat Dorpsweg in Rotterdam,2250,145,4,Furnished,3083 LB,Oud Charlois,https://www.pararius.com/apartment-for-rent/rotterdam/d77b9440/dorpsweg
For rent: Flat Mozartlaan in Rotterdam,1700,77,3,,3055 KJ,Molenlaankwartier,https://www.pararius.com/apartment-for-rent/rotterdam/eb8909ee/mozartlaan
For rent: Flat Kipstraat 41 J in Rotterdam,1470,80,3,,3011 ZX,Stadsdriehoek,https://www.pararius.com/apartment-for-rent/rotterdam/238dff1e/kipstraat
For rent: Flat Groene Hilledijk 298 A2 in Rotterdam,725,50,2,Shell,3074 AG,Hillesluis,https://www.pararius.com/apartment-for-rent/rotterdam/19afb653/groene-hilledijk
For rent: Studio Mathenesserweg in Rotterdam,1500,38,2,Furnished,3027 HG,Spangen,https://www.pararius.com/studio-for-rent/rotterdam/e62ba265/mathenesserweg
For rent: Flat Specerijenhof in Rotterdam,2150,110,3,Furnished,3063 BX,Struisenburg,https://www.pararius.com/apartment-for-rent/rotterdam/56116c61/specerijenhof
For rent: Flat Prinses Margrietlaan in Rotterdam,1900,80,2,Furnished,3051 AP,Hillegersberg Zuid,https://www.pararius.com/apartment-for-rent/rotterdam/907c848d/prinses-margrietlaan
For rent: House Trompetbloem 3 in Rotterdam,1995,111,4,Furnished,3068 AS,Ommoord,https://www.pararius.com/house-for-rent/rotterdam/08e3daec/trompetbloem
For rent: Flat Zuidhoek 266 A-03 in Rotterdam,799,43,2,Upholstered,3082 PT,Oud Charlois,https://www.pararius.com/apartment-for-rent/rotterdam/dc12487d/zuidhoek
For rent: Flat Essenburgsingel 106 A in Rotterdam,1555,65,3,Upholstered,3022 EH,Nieuwe Westen,https://www.pararius.com/apartment-for-rent/rotterdam/8cd1536f/essenburgsingel
For rent: Flat Diergaardesingel 96 B in Rotterdam,855,35,2,Upholstered,3014 AH,Oude Westen,https://www.pararius.com/apartment-for-rent/rotterdam/c936846e/diergaardesingel
For rent: Flat Beukelsdijk 18 A in Rotterdam,1900,73,3,Upholstered,3021 AG,Middelland,https://www.pararius.com/apartment-for-rent/rotterdam/15f8ba11/beukelsdijk
For rent: Flat Beijerlandselaan 173 C in Rotterdam,816,40,2,Upholstered,3074 EH,Hillesluis,https://www.pararius.com/apartment-for-rent/rotterdam/016938fa/beijerlandselaan
For rent: Flat Willebrordusplein 20 K in Rotterdam,1610,66,3,Upholstered,3037 TD,Liskwartier,https://www.pararius.com/apartment-for-rent/rotterdam/5ca4bcea/willebrordusplein
For rent: Flat Binnenrotte in Rotterdam,2850,130,3,Furnished,3011 HC,Stadsdriehoek,https://www.pararius.com/apartment-for-rent/rotterdam/82ebccaa/binnenrotte
For rent: Flat Eendrachtsweg in Rotterdam,1850,50,1,Furnished,3012 LG,Cool,https://www.pararius.com/apartment-for-rent/rotterdam/049e804f/eendrachtsweg
For rent: Flat Van Vollenhovenstraat 3 703 in Rotterdam,1775,52,2,Furnished,3016 BE,Nieuwe Werk,https://www.pararius.com/apartment-for-rent/rotterdam/cca5c1fe/van-vollenhovenstraat
For rent: Flat Ploegstraat in Rotterdam,750,39,2,Upholstered,3075 ND,Vreewijk,https://www.pararius.com/apartment-for-rent/rotterdam/fe1354c4/ploegstraat
For rent: Flat Gedempte Zalmhaven in Rotterdam,3254,83,3,Furnished,3016 DT,Nieuwe Werk,https://www.pararius.com/apartment-for-rent/rotterdam/ef74dc83/gedempte-zalmhaven
For rent: Flat Van Beethovensingel 140 in Rotterdam,2200,89,3,Upholstered,3055 JM,Molenlaankwartier,https://www.pararius.com/apartment-for-rent/rotterdam/c6270a7c/van-beethovensingel
For rent: Flat Stationssingel in Rotterdam,1995,38,2,Furnished,3033 HA,Provenierswijk,https://www.pararius.com/apartment-for-rent/rotterdam/95e043db/stationssingel
For rent: Flat Bergselaan in Rotterdam,1495,103,3,Upholstered,3038 CN,Bergpolder,https://www.pararius.com/apartment-for-rent/rotterdam/a81ff8e0/bergselaan
For rent: Flat Maashaven N.z. in Rotterdam,2650,99,3,Upholstered,3072 AE,Katendrecht,https://www.pararius.com/apartment-for-rent/rotterdam/74c67756/maashaven-n-z
For rent: House Beukelsdijk in Rotterdam,2050,81,2,Upholstered,3021 AJ,Middelland,https://www.pararius.com/house-for-rent/rotterdam/777b3b31/beukelsdijk
For rent: Flat Gedempte Zalmhaven in Rotterdam,3300,90,3,Furnished,3016 DT,Nieuwe Werk,https://www.pararius.com/apartment-for-rent/rotterdam/a3e3d002/gedempte-zalmhaven
For rent: Flat Samuel Mullerstraat in Rotterdam,1795,100,3,Furnished,3023 SM,Nieuwe Westen,https://www.pararius.com/apartment-for-rent/rotterdam/0b0b9702/samuel-mullerstraat
For rent: Flat Statenweg 141 A in Rotterdam,1795,126,4,,3039 HL,Blijdorp,https://www.pararius.com/apartment-for-rent/rotterdam/2c5393de/statenweg
For rent: Flat Saffierstraat in Rotterdam,1950,85,3,,3051 XV,Hillegersberg Zuid,https://www.pararius.com/apartment-for-rent/rotterdam/e0aba882/saffierstraat
For rent: Studio Lieve Verschuierstraat in Rotterdam,1100,27,2,Furnished,3021 ZD,Middelland,https://www.pararius.com/studio-for-rent/rotterdam/b00baa8e/lieve-verschuierstraat
For rent: Flat Boompjes in Rotterdam,2000,80,1,Furnished,3011 XZ,Stadsdriehoek,https://www.pararius.com/apartment-for-rent/rotterdam/ba2d840c/boompjes
For rent: Flat Haringvliet in Rotterdam,1550,55,2,Furnished,3011 TG,Stadsdriehoek,https://www.pararius.com/apartment-for-rent/rotterdam/8f2ba34c/haringvliet
For rent: Flat Schiehavenkade in Rotterdam,2950,136,3,Furnished,3024 EZ,Schiemond,https://www.pararius.com/apartment-for-rent/rotterdam/bd6b6067/schiehavenkade
For rent: Flat Jan Evertsenplaats in Rotterdam,2695,95,3,Furnished,3012 HN,Cool,https://www.pararius.com/apartment-for-rent/rotterdam/bff3f5f5/jan-evertsenplaats
For rent: Flat Bergweg in Rotterdam,2485,75,3,Upholstered,3036 BH,Oude Noorden,https://www.pararius.com/apartment-for-rent/rotterdam/533db0d8/bergweg
For rent: Flat Westersingel in Rotterdam,1575,63,2,Furnished,3014 GM,Cool,https://www.pararius.com/apartment-for-rent/rotterdam/83871c4d/westersingel
For rent: Flat Nieuwe Binnenweg in Rotterdam,2175,75,3,Upholstered,3015 BG,Oude Westen,https://www.pararius.com/apartment-for-rent/rotterdam/4c11d2a1/nieuwe-binnenweg
For rent: Flat Berberisweg 434 D in Rotterdam,1678,90,3,,3053 PL,Schiebroek,https://www.pararius.com/apartment-for-rent/rotterdam/51dfcc4c/berberisweg
For rent: Flat Kapelstraat 93 in Rotterdam,1595,109,3,Upholstered,3024 CH,Delfshaven,https://www.pararius.com/apartment-for-rent/rotterdam/f855e94f/kapelstraat
For rent: Flat Van Vollenhovenstraat in Rotterdam,1138,50,2,Upholstered,3016 BG,Nieuwe Werk,https://www.pararius.com/apartment-for-rent/rotterdam/05cc7c42/van-vollenhovenstraat
For rent: Flat Berberisweg 416 in Rotterdam,1903,108,4,,3053 PL,Schiebroek,https://www.pararius.com/apartment-for-rent/rotterdam/52b16784/berberisweg
For rent: House Hommelstraat in Rotterdam,2800,128,4,Furnished,3061 VA,Kralingen West,https://www.pararius.com/house-for-rent/rotterdam/7ba3982b/hommelstraat
For rent: Flat Molenvliet in Rotterdam,2095,100,4,Furnished,3076 CL,Lombardijen,https://www.pararius.com/apartment-for-rent/rotterdam/cb221eef/molenvliet
For rent: House Eigelhorst in Rotterdam,2550,133,5,Upholstered or furnished,3085 VE,Zuidwijk,https://www.pararius.com/house-for-rent/rotterdam/37933462/eigelhorst
For rent: Flat Noordsingel in Rotterdam,1030,70,2,Shell,3032 BH,Agniesebuurt,https://www.pararius.com/apartment-for-rent/rotterdam/41c1b73b/noordsingel
For rent: Flat Churchillplein 80 in Rotterdam,2250,96,3,Upholstered or furnished,3011 EW,Stadsdriehoek,https://www.pararius.com/apartment-for-rent/rotterdam/8f6cc467/churchillplein
For rent: Flat Karl Weisbardstraat in Rotterdam,3220,80,3,Furnished,3015 GM,Dijkzigt,https://www.pararius.com/apartment-for-rent/rotterdam/2d5c4377/karl-weisbardstraat
For rent: Flat 1e Jerichostraat in Rotterdam,640,42,2,Upholstered,3061 GK,Kralingen West,https://www.pararius.com/apartment-for-rent/rotterdam/dafdfefb/1e-jerichostraat
For rent: Flat 1e Jerichostraat in Rotterdam,715,42,1,Upholstered,3061 GK,Kralingen West,https://www.pararius.com/apartment-for-rent/rotterdam/3808afe5/1e-jerichostraat
For rent: Flat Nieuwe Binnenweg in Rotterdam,1845,66,2,Furnished,3014 GD,Oude Westen,https://www.pararius.com/apartment-for-rent/rotterdam/867a756a/nieuwe-binnenweg
For rent: Flat Soetendaalseweg in Rotterdam,2250,101,4,Upholstered,3036 ET,Oude Noorden,https://www.pararius.com/apartment-for-rent/rotterdam/8c01f69b/soetendaalseweg
For rent: Flat Rodenrijselaan in Rotterdam,690,61,3,Upholstered,3037 XG,Liskwartier,https://www.pararius.com/apartment-for-rent/rotterdam/49be19da/rodenrijselaan
For rent: Flat Rijnhavenkade 34 in Rotterdam,3000,84,3,Furnished,3072 JS,Katendrecht,https://www.pararius.com/apartment-for-rent/rotterdam/b4295ed8/rijnhavenkade
For rent: Flat Dunantstraat in Rotterdam,1100,122,3,Upholstered,3024 BC,Delfshaven,https://www.pararius.com/apartment-for-rent/rotterdam/476588a3/dunantstraat
For rent: Flat Walenburgerweg in Rotterdam,1850,108,3,Upholstered,3033 AK,Provenierswijk,https://www.pararius.com/apartment-for-rent/rotterdam/ca5faff1/walenburgerweg
For rent: Flat Polanenstraat in Rotterdam,1309,86,2,Furnished,3062 KB,Kralingen Oost,https://www.pararius.com/apartment-for-rent/rotterdam/7c69d121/polanenstraat
For rent: House Hooidrift in Rotterdam,2600,145,4,Furnished,3023 KG,Nieuwe Westen,https://www.pararius.com/house-for-rent/rotterdam/e300d16b/hooidrift
For rent: Flat Baan 40 L in Rotterdam,1995,77,3,Upholstered,3011 CC,Stadsdriehoek,https://www.pararius.com/apartment-for-rent/rotterdam/3f304378/baan
For rent: Flat Graaf Balderikstraat in Rotterdam,1425,52,2,Furnished,3032 HC,Oude Noorden,https://www.pararius.com/apartment-for-rent/rotterdam/73aede93/graaf-balderikstraat
For rent: Flat Vierambachtsstraat 28 A-01 in Rotterdam,1650,69,3,Shell,3023 AN,Nieuwe Westen,https://www.pararius.com/apartment-for-rent/rotterdam/b790c821/vierambachtsstraat
For rent: Flat Graaf Balderikstraat 102 in Rotterdam,1481,52,2,Furnished,3032 HC,Oude Noorden,https://www.pararius.com/apartment-for-rent/rotterdam/c9a5f5b8/graaf-balderikstraat
For rent: Flat Spoorsingel in Rotterdam,1495,63,2,Furnished,3033 GP,Provenierswijk,https://www.pararius.com/apartment-for-rent/rotterdam/eb25789f/spoorsingel
For rent: Flat Spoorsingel in Rotterdam,1495,63,2,Furnished,3033 GP,Provenierswijk,https://www.pararius.com/apartment-for-rent/rotterdam/1e5ce900/spoorsingel
For rent: Flat Westerstraat 20 N in Rotterdam,2350,80,3,Furnished,3016 DH,Nieuwe Werk,https://www.pararius.com/apartment-for-rent/rotterdam/e4827333/westerstraat
For rent: Flat Groene Hilledijk in Rotterdam,1883,92,5,Upholstered,3073 AB,Bloemhof,https://www.pararius.com/apartment-for-rent/rotterdam/2e951041/groene-hilledijk
For rent: Flat Schapendreef in Rotterdam,1650,74,3,,3034 ZL,Oud Crooswijk,https://www.pararius.com/apartment-for-rent/rotterdam/c8524665/schapendreef
For rent: Flat Van Oldenbarneveltplaats in Rotterdam,1725,89,3,Upholstered,3012 AJ,Cool,https://www.pararius.com/apartment-for-rent/rotterdam/5d95f71d/van-oldenbarneveltplaats
For rent: Flat Jan Pettersonstraat in Rotterdam,2250,90,3,Furnished,3077 MN,Oud IJsselmonde,https://www.pararius.com/apartment-for-rent/rotterdam/4f70bfea/jan-pettersonstraat
For rent: Flat Kasteelweg in Rotterdam,1175,32,2,Furnished,3077 BN,Oud IJsselmonde,https://www.pararius.com/apartment-for-rent/rotterdam/df6420e6/kasteelweg
For rent: Flat Burgemeester Meineszlaan in Rotterdam,1400,138,3,Upholstered,3022 BJ,Nieuwe Westen,https://www.pararius.com/apartment-for-rent/rotterdam/59c214ce/burgemeester-meineszlaan
For rent: Flat Mauritsstraat in Rotterdam,1250,24,2,Upholstered,3012 CH,Cool,https://www.pararius.com/apartment-for-rent/rotterdam/3083a59a/mauritsstraat
For rent: House Molenlaan 41 in Rotterdam,4000,172,6,Furnished,3055 EG,Molenlaankwartier,https://www.pararius.com/house-for-rent/rotterdam/5eb9daef/molenlaan
For rent: Flat Rijnhavenkade in Rotterdam,2995,82,2,Furnished,3072 JS,Katendrecht,https://www.pararius.com/apartment-for-rent/rotterdam/7242e3dd/rijnhavenkade
For rent: Flat Scheepstimmermanslaan 27 D in Rotterdam,1850,62,2,Upholstered,3016 AD,Nieuwe Werk,https://www.pararius.com/apartment-for-rent/rotterdam/2b2e3214/scheepstimmermanslaan
For rent: Flat Proveniersstraat in Rotterdam,2395,120,3,Shell,3033 CM,Provenierswijk,https://www.pararius.com/apartment-for-rent/rotterdam/41874520/proveniersstraat
For rent: Flat Nico Koomanskade in Rotterdam,3499,124,4,Furnished,3072 LM,Katendrecht,https://www.pararius.com/apartment-for-rent/rotterdam/29b30700/nico-koomanskade
For rent: Flat Lusthofstraat in Rotterdam,1895,60,3,Furnished,3061 WJ,Kralingen West,https://www.pararius.com/apartment-for-rent/rotterdam/2ee7d024/lusthofstraat
For rent: Flat Noordmolenstraat in Rotterdam,1850,60,2,Furnished,3035 RD,Oude Noorden,https://www.pararius.com/apartment-for-rent/rotterdam/0f50dd46/noordmolenstraat
For rent: House Lijsterlaan 35 in Rotterdam,2850,135,6,Upholstered,3055 CD,Molenlaankwartier,https://www.pararius.com/house-for-rent/rotterdam/03cb1ed2/lijsterlaan
For rent: Flat Binnenrotte in Rotterdam,2750,92,3,Furnished,3011 HC,Stadsdriehoek,https://www.pararius.com/apartment-for-rent/rotterdam/d3e103f0/binnenrotte
For rent: Flat Rijnhavenkade in Rotterdam,2950,87,3,,3072 JS,Katendrecht,https://www.pararius.com/apartment-for-rent/rotterdam/53c21b03/rijnhavenkade
For rent: Flat Claes de Vrieselaan in Rotterdam,2950,110,3,Furnished,3021 JE,Middelland,https://www.pararius.com/apartment-for-rent/rotterdam/0c6262ad/claes-de-vrieselaan
For rent: Flat Narcissenstraat in Rotterdam,1525,55,2,Upholstered,3073 CL,Bloemhof,https://www.pararius.com/apartment-for-rent/rotterdam/76586f5c/narcissenstraat
For rent: Flat Weena in Rotterdam,2525,90,3,Furnished,3013 CE,Stadsdriehoek,https://www.pararius.com/apartment-for-rent/rotterdam/34d864f9/weena
For rent: Flat Hoogstraat 20 B in Rotterdam,2250,70,3,Furnished,3011 PP,Stadsdriehoek,https://www.pararius.com/apartment-for-rent/rotterdam/698b9ca8/hoogstraat
For rent: Flat Doggerstraat 7 C in Rotterdam,1501,85,5,Upholstered,3028 HK,Oud Mathenesse,https://www.pararius.com/apartment-for-rent/rotterdam/34590654/doggerstraat
For rent: Flat Statenweg in Rotterdam,1950,120,4,Upholstered,3039 JN,Blijdorp,https://www.pararius.com/apartment-for-rent/rotterdam/735686bd/statenweg
For rent: Flat Borgesiusstraat in Rotterdam,995,71,2,Shell,3038 TD,Bergpolder,https://www.pararius.com/apartment-for-rent/rotterdam/1b2b484e/borgesiusstraat
For rent: Flat Adriaen van der Doeslaan in Rotterdam,536,23,1,,3054 EB,Hillegersberg Noord,https://www.pararius.com/apartment-for-rent/rotterdam/549d6160/adriaen-van-der-doeslaan
For rent: Flat Nolensstraat 29 A in Rotterdam,2250,91,4,Furnished,3039 PL,Blijdorp,https://www.pararius.com/apartment-for-rent/rotterdam/27d9c3f0/nolensstraat
For rent: Flat Kruisplein in Rotterdam,2495,110,3,Furnished,3012 CC,Cool,https://www.pararius.com/apartment-for-rent/rotterdam/726e11b5/kruisplein
For rent: Flat Baan 42 K in Rotterdam,2095,83,2,Upholstered,3011 CC,Stadsdriehoek,https://www.pararius.com/apartment-for-rent/rotterdam/baa955c0/baan
For rent: Flat Wilhelminakade in Rotterdam,2250,76,2,Furnished,3072 AP,Kop van Zuid,https://www.pararius.com/apartment-for-rent/rotterdam/c7d5a8d0/wilhelminakade
For rent: Flat Prins Frederikplein in Rotterdam,1895,84,3,Upholstered,3071 KS,Noordereiland,https://www.pararius.com/apartment-for-rent/rotterdam/19210d46/prins-frederikplein
For rent: Flat Bundweg 77 in Rotterdam,2505,128,3,Upholstered,3072 JX,Katendrecht,https://www.pararius.com/apartment-for-rent/rotterdam/66ab2a2d/bundweg
For rent: Flat Mijnsherenlaan in Rotterdam,471,11,1,Shell,3081 GS,Tarwewijk,https://www.pararius.com/apartment-for-rent/rotterdam/69d819e9/mijnsherenlaan
For rent: Flat Mijnsherenlaan in Rotterdam,581,15,1,Shell,3081 GS,Tarwewijk,https://www.pararius.com/apartment-for-rent/rotterdam/8a615cee/mijnsherenlaan
For rent: Flat Eric Kropstraat in Rotterdam,3500,140,3,Furnished,3071 AE,Kop van Zuid - Entrepot,https://www.pararius.com/apartment-for-rent/rotterdam/1debd1b6/eric-kropstraat
For rent: Flat Willem van Hillegaersbergstraat in Rotterdam,2900,120,3,Furnished,3051 RP,Hillegersberg Zuid,https://www.pararius.com/apartment-for-rent/rotterdam/d2eb9321/willem-van-hillegaersbergstraat
For rent: Flat Mijnsherenlaan in Rotterdam,528,15,1,Shell,3081 GS,Tarwewijk,https://www.pararius.com/apartment-for-rent/rotterdam/9d63c704/mijnsherenlaan
For rent: Flat Statenlaan in Rotterdam,1395,66,2,,3051 HN,Hillegersberg Zuid,https://www.pararius.com/apartment-for-rent/rotterdam/710a6bf7/statenlaan
For rent: Flat Specerijenhof 27 in Rotterdam,1950,92,3,Furnished,3063 BX,Struisenburg,https://www.pararius.com/apartment-for-rent/rotterdam/f61fa0ec/specerijenhof
For rent: Flat Handelsplein 107 in Rotterdam,1975,110,2,Furnished,3071 PR,Kop van Zuid - Entrepot,https://www.pararius.com/apartment-for-rent/rotterdam/8ea62b0b/handelsplein
For rent: Flat Noordsingel 162 A 01 in Rotterdam,2500,138,4,Furnished,3032 BK,Agniesebuurt,https://www.pararius.com/apartment-for-rent/rotterdam/695bf8d9/noordsingel
For rent: Flat Schieweg in Rotterdam,1995,87,3,Upholstered,3038 AC,Bergpolder,https://www.pararius.com/apartment-for-rent/rotterdam/b4a8cc29/schieweg
For rent: Flat Slaak in Rotterdam,1995,100,4,Furnished,3061 CZ,Kralingen West,https://www.pararius.com/apartment-for-rent/rotterdam/48004def/slaak
For rent: Flat Schepenstraat in Rotterdam,2150,112,4,Upholstered,3039 NP,Blijdorp,https://www.pararius.com/apartment-for-rent/rotterdam/6e73d5b0/schepenstraat
For rent: Flat Kierkegaardstraat in Rotterdam,1995,90,4,Furnished,3076 RJ,Lombardijen,https://www.pararius.com/apartment-for-rent/rotterdam/ad0e7f7a/kierkegaardstraat
For rent: Flat Grotekerkplein in Rotterdam,1495,33,2,Upholstered,3011 GD,Stadsdriehoek,https://www.pararius.com/apartment-for-rent/rotterdam/bb5f2fb4/grotekerkplein
For rent: Flat Vorkstraat in Rotterdam,1750,84,3,Furnished,3075 NT,Vreewijk,https://www.pararius.com/apartment-for-rent/rotterdam/1e80fdea/vorkstraat
For rent: Room Hogenbanweg in Rotterdam,550,18,4,Furnished,3028 GM,Oud Mathenesse,https://www.pararius.com/room-for-rent/rotterdam/bc93c180/hogenbanweg
For rent: Flat Dorpsweg 104 B in Rotterdam,2295,88,5,Furnished,3083 LG,Carnisse,https://www.pararius.com/apartment-for-rent/rotterdam/4f371113/dorpsweg
For rent: Flat Scheepmakerspassage in Rotterdam,2500,84,3,Upholstered or furnished,3011 VH,Stadsdriehoek,https://www.pararius.com/apartment-for-rent/rotterdam/82f0f1b1/scheepmakerspassage
For rent: Flat Adriaan Kooningsstraat in Rotterdam,2750,118,3,Furnished,3077 ML,Oud IJsselmonde,https://www.pararius.com/apartment-for-rent/rotterdam/80293a36/adriaan-kooningsstraat
For rent: Flat Bonaventurastraat in Rotterdam,1068,100,4,Furnished,3081 HJ,Tarwewijk,https://www.pararius.com/apartment-for-rent/rotterdam/6fdbcb65/bonaventurastraat
For rent: Flat Ploegstraat in Rotterdam,1995,78,4,Furnished,3075 NG,Vreewijk,https://www.pararius.com/apartment-for-rent/rotterdam/860d33d8/ploegstraat
For rent: Flat Joost van Geelstraat in Rotterdam,750,37,2,Upholstered,3021 VP,Middelland,https://www.pararius.com/apartment-for-rent/rotterdam/0ee7d6d9/joost-van-geelstraat
For rent: Flat Weena in Rotterdam,2750,85,3,Furnished,3013 CE,Stadsdriehoek,https://www.pararius.com/apartment-for-rent/rotterdam/2b496b36/weena
For rent: Flat West-Varkenoordseweg in Rotterdam,581,19,1,Shell,3074 HW,Hillesluis,https://www.pararius.com/apartment-for-rent/rotterdam/576b0014/west-varkenoordseweg
For rent: Flat Adolphine Kokplein 33 in Rotterdam,1625,79,2,,3052 SJ,Schiebroek,https://www.pararius.com/apartment-for-rent/rotterdam/c3671dc5/adolphine-kokplein
For rent: Flat Schapendreef in Rotterdam,1159,74,3,Furnished,3034 ZL,Oud Crooswijk,https://www.pararius.com/apartment-for-rent/rotterdam/64202b0e/schapendreef
For rent: House Teldersweg 106 in Rotterdam,2050,120,5,,3052 TL,Schiebroek,https://www.pararius.com/house-for-rent/rotterdam/49e64d1c/teldersweg
For rent: Flat Scheepstimmermanslaan 3 in Rotterdam,1215,38,2,,3016 AC,Nieuwe Werk,https://www.pararius.com/apartment-for-rent/rotterdam/25d65db0/scheepstimmermanslaan
For rent: Flat West-Varkenoordseweg in Rotterdam,531,19,1,Shell,3074 HW,Hillesluis,https://www.pararius.com/apartment-for-rent/rotterdam/56813100/west-varkenoordseweg
For rent: Flat Lisstraat in Rotterdam,2350,112,4,Furnished,3037 RA,Liskwartier,https://www.pararius.com/apartment-for-rent/rotterdam/5166130c/lisstraat
For rent: Flat Westzeedijk 509 G in Rotterdam,1755,80,3,,3024 EL,Delfshaven,https://www.pararius.com/apartment-for-rent/rotterdam/ca120e6c/westzeedijk
For rent: Flat Argonautenweg in Rotterdam,2650,95,3,Furnished,3054 RP,Hillegersberg Noord,https://www.pararius.com/apartment-for-rent/rotterdam/f56e4143/argonautenweg
For rent: House Breedveldsingel in Rotterdam,3500,166,5,Upholstered,3055 PK,Molenlaankwartier,https://www.pararius.com/house-for-rent/rotterdam/76e30608/breedveldsingel
For rent: Flat Westblaak in Rotterdam,2080,72,3,Upholstered,3012 KE,Cool,https://www.pararius.com/apartment-for-rent/rotterdam/110335b7/westblaak
For rent: Flat Charlotte de Bourbonlaan in Rotterdam,2765,135,6,Upholstered,3062 GB,Kralingen Oost,https://www.pararius.com/apartment-for-rent/rotterdam/dfb03ba0/charlotte-de-bourbonlaan
For rent: Flat Bloemfonteinstraat in Rotterdam,1825,94,3,Upholstered,3072 HG,Afrikaanderwijk,https://www.pararius.com/apartment-for-rent/rotterdam/6043136a/bloemfonteinstraat
For rent: Flat Bergse Rechter Rottekade in Rotterdam,3995,142,3,Furnished,3051 AC,Hillegersberg Zuid,https://www.pararius.com/apartment-for-rent/rotterdam/e5efe05d/bergse-rechter-rottekade
For rent: Flat Houtlaan in Rotterdam,4995,136,4,Furnished,3016 DA,Nieuwe Werk,https://www.pararius.com/apartment-for-rent/rotterdam/c761e61d/houtlaan
For rent: Flat Jufferstraat in Rotterdam,1795,70,3,Furnished,3011 XM,Stadsdriehoek,https://www.pararius.com/apartment-for-rent/rotterdam/694219df/jufferstraat
For rent: Flat Zuidhoek 270 A in Rotterdam,1900,90,3,Upholstered or furnished,3082 PT,Oud Charlois,https://www.pararius.com/apartment-for-rent/rotterdam/3fe89e09/zuidhoek
For rent: Flat Vorkstraat in Rotterdam,1450,64,2,Furnished,3075 NT,Vreewijk,https://www.pararius.com/apartment-for-rent/rotterdam/aa7e91b3/vorkstraat
For rent: Flat Strevelsweg in Rotterdam,1858,102,4,Upholstered,3073 DX,Bloemhof,https://www.pararius.com/apartment-for-rent/rotterdam/5c83254c/strevelsweg
For rent: Flat Zuidhoek 270 C in Rotterdam,1850,81,3,Upholstered or furnished,3082 PT,Oud Charlois,https://www.pararius.com/apartment-for-rent/rotterdam/6eeea9e5/zuidhoek
For rent: Flat Zuidhoek 270 B in Rotterdam,2000,79,4,Upholstered or furnished,3082 PT,Oud Charlois,https://www.pararius.com/apartment-for-rent/rotterdam/8d51b6ea/zuidhoek
For rent: Flat M端llerkade in Rotterdam,2450,92,3,Upholstered,3024 EP,Schiemond,https://www.pararius.com/apartment-for-rent/rotterdam/bd298d05/muellerkade
For rent: Studio Pleinweg in Rotterdam,1500,50,2,Upholstered,3083 EP,Carnisse,https://www.pararius.com/studio-for-rent/rotterdam/fa67f916/pleinweg
For rent: Flat Gedempte Zalmhaven in Rotterdam,2200,85,3,Furnished,3011 BT,Stadsdriehoek,https://www.pararius.com/apartment-for-rent/rotterdam/d03e6759/gedempte-zalmhaven
For rent: Flat 's-Gravendijkwal in Rotterdam,1700,85,3,Upholstered,3014 EK,Oude Westen,https://www.pararius.com/apartment-for-rent/rotterdam/72505728/s-gravendijkwal
